{
  "schemaVersion": 1,
  "pipelineContract": "YS-ASSET-PIPELINE-v7",
  "profile": "complete-layer",
  "id": "BG-EXTERIOR-S0-CLOSED",
  "sourceRevision": 2,
  "runtimeBuild": 1,
  "screenUnit": "SCR-STORY-PROLOGUE:S0-STATE-KEY",
  "allPriorGatesPassed": true,
  "runtimeRegistrationAllowed": true,
  "evidence": {
    "provenance": {
      "file": "provenance.json",
      "sha256": "f258c17230db2aa024a601b8af56659544be708744a568815d1d3a683b9b9bc1"
    },
    "profileApproval": {
      "file": "completion-report.json",
      "sha256": "c43946955b0f7906166e2cfafe5f8afc03ae61b569a7dfc29d70d655f268d6c9"
    },
    "recomposition": {
      "file": "recomposition-report.json",
      "sha256": "6504625f20c46fb6217bba3355001a11396b5f3432ce72c181917cdf5ab62d49"
    },
    "optimization": {
      "file": "optimization-report.json",
      "sha256": "f742c41a03393995417fdd60fd4af245b33550eedf72c189c8d15770b0296a4f"
    },
    "finalApproval": {
      "file": "final-approval.json",
      "sha256": "d9b914ae81f9271e15957d615be4e39c93df7f82fe4782da19ee40c1e5e390fa"
    }
  },
  "manifestEntry": {
    "file": "runtime-manifest-entry.json",
    "sha256": "275a5d3760fc2e0fb956dab41b6e40f2da8df70b28b4e5cb379517eb63f593f6"
  },
  "bundle": [
    {
      "role": "primary",
      "sourceFile": "../assets/bg-exterior-s0-closed-r2-pixel-fhd.png",
      "url": "/assets/core/s0/prologue/bg-exterior-s0-closed-r2-b1.png",
      "sha256": "504bc88e874a53e6a69e7dcfaad11cc949b654166d17815cae15a9948e67be21",
      "bytes": 2616094,
      "format": "png",
      "dimensions": {
        "width": 1920,
        "height": 1080
      }
    }
  ],
  "generatedAt": "2026-07-30T14:02:53.394Z"
}
